{
  "schema_version": "0.2.0",
  "id": "ascon-post-quantum-security-independent-permutations",
  "group_id": "ascon-post-quantum-security-independent-permutations",
  "title": "Post-Quantum Security of Ascon with Independent Permutations",
  "summary": "The existing approach fails when Ascon's two permutations are modeled independently; a post-quantum security proof for that setting remains open.",
  "formal_statement": {
    "format": "markdown-latex",
    "body": "Establish a post-quantum security proof for $\\mathrm{Ascon}$ when its underlying permutations $p_a$ and $p_b$ are modeled as independent random permutations; the existing proof approach does not apply under this independence assumption."
  },
  "scope": {
    "domain": "Post-quantum security analysis of Ascon under random-permutation modeling.",
    "assumptions": [
      "The underlying permutations p_a and p_b are modeled as independent random permutations."
    ],
    "parameters": [
      "p_a and p_b: Ascon's underlying permutations"
    ],
    "unresolved_remainder": "Establish a post-quantum security proof for Ascon in the independent-random-permutation model."
  },
  "classification": {
    "taxonomy_version": "0.2.0",
    "primary": "design.macs-authenticated-encryption",
    "secondary": [],
    "tags": [
      "post-quantum-security",
      "ascon",
      "random-permutation-model"
    ]
  },
  "source": {
    "kind": "explicit_open_problem",
    "citations": [
      {
        "role": "original_source",
        "label": "Post-Quantum Security of Keyed Sponge-Based Constructions through a Modular Approach",
        "locator": "ASIACRYPT 2025, page 31",
        "doi": "10.1007/978-981-95-5018-0_14",
        "url": "https://eprint.iacr.org/2025/1059",
        "eprint": "2025/1059"
      }
    ]
  },
  "status": {
    "public_mathematical_status": "open",
    "public_verification_status": "none",
    "peer_review_status": "not_submitted",
    "disclosure": "problem_only",
    "last_reviewed": "2026-08-31"
  },
  "progress": [
    {
      "date": "2025-01-01",
      "kind": "source_statement",
      "summary": "The paper presents this as future work after noting that its existing proof approach does not apply when p_a and p_b are modeled as independent permutations.",
      "citation_labels": [
        "Akinori Hosoyamada et al., Post-Quantum Security of Keyed Sponge-Based Constructions through a Modular Approach"
      ]
    }
  ],
  "artifacts": [],
  "lean": {
    "status": "none",
    "available_in_repo": false
  },
  "relations": {
    "related": [],
    "supersedes": [],
    "superseded_by": []
  }
}
