{
  "schema_version": "0.2.0",
  "id": "four-round-spn-probability-one-differentials",
  "group_id": "four-round-spn-probability-one-differentials",
  "title": "Extending Probability-One Differential Analysis to Four-Round SPNs",
  "summary": "Probability-one differentials have been analyzed for two-round SPNs; the open task is to extend this to four rounds using superboxes with non-maximal boomerang uniformity.",
  "formal_statement": {
    "format": "markdown-latex",
    "body": "For four-round substitution-permutation networks (SPNs), extend the probability-one differential analysis considered for two-round SPNs by replacing individual S-boxes with superboxes, where a superbox consists of two SPN rounds, and derive conditions guaranteeing that such a superbox does not have maximal boomerang uniformity. The unresolved question is to identify the relevant structural or cryptanalytic conditions under which this non-maximal-uniformity property holds, so that the probability-one differential analysis can be generalized from two rounds to four rounds."
  },
  "scope": {
    "domain": "Differential cryptanalysis of four-round substitution-permutation networks using two-round SPN superboxes.",
    "assumptions": [
      "None"
    ],
    "parameters": [
      "Four SPN rounds — target network depth for the extension",
      "Two SPN rounds — network depth represented by each superbox"
    ],
    "unresolved_remainder": "Identify structural or cryptanalytic conditions under which a two-round SPN superbox has non-maximal boomerang uniformity, enabling the probability-one differential analysis to extend to four rounds."
  },
  "classification": {
    "taxonomy_version": "0.2.0",
    "primary": "cryptanalysis.differential",
    "secondary": [],
    "tags": [
      "differential-cryptanalysis",
      "substitution-permutation-networks",
      "boomerang-uniformity"
    ]
  },
  "source": {
    "kind": "explicit_open_problem",
    "citations": [
      {
        "role": "original_source",
        "label": "On Perfect Linear Approximations and Differentials over Two-Round SPNs",
        "locator": "CRYPTO 2023, page 30",
        "doi": "10.1007/978-3-031-38548-3_8",
        "url": "https://eprint.iacr.org/2023/725",
        "eprint": "2023/725"
      }
    ]
  },
  "status": {
    "public_mathematical_status": "open",
    "public_verification_status": "none",
    "peer_review_status": "not_submitted",
    "disclosure": "problem_only",
    "last_reviewed": "2026-09-01"
  },
  "progress": [
    {
      "date": "2023-01-01",
      "kind": "source_statement",
      "summary": "The source presents the four-round extension as future work and singles out ensuring non-maximal boomerang uniformity for two-round superboxes as the unresolved technical question.",
      "citation_labels": [
        "Christof Beierle et al., On Perfect Linear Approximations and Differentials over Two-Round SPNs"
      ]
    }
  ],
  "artifacts": [],
  "lean": {
    "status": "none",
    "available_in_repo": false
  },
  "relations": {
    "related": [],
    "supersedes": [],
    "superseded_by": []
  }
}
